{
  "allowed_paths": [
    "receipts/sovereign-runtime-activation/**",
    "StegVerse-Labs/.github",
    "master-records/orchestration",
    "StegVerse-002/micro-node-runtime"
  ],
  "authority_effect": "none_adapter_scope_enforcement_only",
  "changed_paths": [
    "receipts/sovereign-runtime-activation/SHWP-DURABLE-RUNTIME-ACTIVATION.json"
  ],
  "claim_id": "SHWP-SHWP-DURABLE-RUNTIME-ACTIVATION-G18",
  "decision": "ALLOW",
  "fencing_token": 18,
  "heartbeat_epoch": 15,
  "reason": "ALL_MUTATIONS_WITHIN_CURRENT_FENCED_SCOPE",
  "schema": "stegverse.worker-mutation-scope-receipt/v0.1",
  "task_id": "SHWP-DURABLE-RUNTIME-ACTIVATION"
}
