{
  "allowed_paths": [
    "receipts/ecosystem-chat-sovereign-inference/**"
  ],
  "authority_effect": "none_adapter_scope_enforcement_only",
  "changed_paths": [
    "receipts/ecosystem-chat-sovereign-inference/SHWP-ECOSYSTEM-CHAT-INFERENCE-001.json"
  ],
  "claim_id": "SHWP-SHWP-ECOSYSTEM-CHAT-INFERENCE-001-G20",
  "decision": "ALLOW",
  "fencing_token": 20,
  "heartbeat_epoch": 19,
  "reason": "ALL_MUTATIONS_WITHIN_CURRENT_FENCED_SCOPE",
  "schema": "stegverse.worker-mutation-scope-receipt/v0.1",
  "task_id": "SHWP-ECOSYSTEM-CHAT-INFERENCE-001"
}
